{
  "id": "pulmonary_embolism",
  "title": "Pulmonary embolism",
  "contentVersion": "0.1.2",
  "source": "NICE Clinical Knowledge Summaries",
  "sourceReference": "Pulmonary embolism",
  "sourceUrl": "https://cks.nice.org.uk/topics/pulmonary-embolism/",
  "sourceUpdated": "TO BE CONFIRMED",
  "appReviewed": "2026-07-22",
  "minimumAppVersion": "0.17.0",
  "status": "active",
  "sections": [
    {
      "id": "overview",
      "title": "Overview",
      "body": [
        "PLACEHOLDER: Add the agreed scope, intended population and exclusions from the authorised source content.",
        "This placeholder is delivered through the governed remote clinical-content pack."
      ]
    },
    {
      "id": "red_flags",
      "title": "Immediate red flags",
      "warning": true,
      "body": [
        "PLACEHOLDER: Add concrete findings requiring emergency assessment, including numerical thresholds and observable examples.",
        "Do not use a low-risk rule to override haemodynamic compromise, hypoxia, syncope, severe breathlessness or another time-critical diagnosis."
      ]
    },
    {
      "id": "assessment",
      "title": "Assessment",
      "body": [
        "PLACEHOLDER: Add history, examination, observation and differential-diagnosis prompts.",
        "Record positive findings and relevant negatives rather than documenting only that PE was considered."
      ]
    },
    {
      "id": "perc",
      "title": "PERC pathway",
      "body": [
        "PLACEHOLDER: State the exact eligibility conditions before PERC may be applied.",
        "Link this section to the existing PERC calculator in a later app build if direct in-page navigation is required."
      ]
    },
    {
      "id": "wells",
      "title": "Two-level PE Wells pathway",
      "body": [
        "PLACEHOLDER: Add the authorised criteria, score interpretation and required downstream investigation pathway."
      ]
    },
    {
      "id": "investigations",
      "title": "Investigations",
      "body": [
        "PLACEHOLDER: Add D-dimer, imaging and other investigation guidance, including what cannot be completed prehospitally."
      ]
    },
    {
      "id": "management",
      "title": "Management",
      "body": [
        "PLACEHOLDER: Add immediate treatment, interim anticoagulation and referral guidance only after source verification and local-pathway review."
      ]
    },
    {
      "id": "disposition",
      "title": "Disposition",
      "body": [
        "PLACEHOLDER: Add emergency conveyance, same-day assessment and circumstances in which a PE pathway may be stopped.",
        "A score addresses a defined risk only and does not independently authorise scene discharge."
      ]
    },
    {
      "id": "safety_netting",
      "title": "Safety-netting",
      "body": [
        "PLACEHOLDER: Add concrete return precautions, follow-up timeframe and actions if symptoms recur or worsen."
      ],
      "warning": true
    }
  ],
  "references": [
    "NICE-NG158"
  ],
  "clinicalValidation": {
    "validated": true,
    "reviewedBy": "Sean McGrory",
    "reviewedOn": "2026-08-11",
    "reviewerRole": "tAPUC",
    "nextReviewDue": "2027-08-11",
    "reviewNotes": null
  }
}
